{
  "schema_version": "0.1",
  "run_id": "fixture_research_positive_control_r3",
  "protocol_version": "0.1",
  "mode": "fixture",
  "task_family": "research",
  "task_id": "research",
  "scenario_id": "research_positive_control",
  "control": "positive_control",
  "expected_role": "positive",
  "model_id": "fixture-no-provider-deterministic-v1",
  "scaffold_id": "full_scaffold",
  "evaluation_profile": "strict",
  "created_at": "2026-05-23T00:00:00Z",
  "output": {
    "executive_summary": "Synthetic sources indicate orchestration quality matters.",
    "key_findings": [
      {
        "finding": "Most failures occur in orchestration layer",
        "sources": [
          "A"
        ],
        "confidence": "high",
        "enterprise_implication": "Scaffold quality should be measured explicitly."
      },
      {
        "finding": "Tool selection + context overflow + retry failures breakdown",
        "sources": [
          "A"
        ],
        "confidence": "high",
        "enterprise_implication": "Scaffold quality should be measured explicitly."
      },
      {
        "finding": "Testing infrastructure predicts production success",
        "sources": [
          "B"
        ],
        "confidence": "high",
        "enterprise_implication": "Scaffold quality should be measured explicitly."
      },
      {
        "finding": "Verification gates improve completion",
        "sources": [
          "C"
        ],
        "confidence": "high",
        "enterprise_implication": "Scaffold quality should be measured explicitly."
      },
      {
        "finding": "Memory helps multi-step tasks, minimal benefit single-step",
        "sources": [
          "C"
        ],
        "confidence": "high",
        "enterprise_implication": "Scaffold quality should be measured explicitly."
      },
      {
        "finding": "Scaffolding/testing spend correlates with scaled deployment",
        "sources": [
          "D"
        ],
        "confidence": "high",
        "enterprise_implication": "Scaffold quality should be measured explicitly."
      }
    ],
    "synthesis": "orchestration 67% failures tool selection 31% context 22% retry 14% testing infrastructure 4.2 11.7 verification 23% memory multi-step 41% 3% scaffolding testing 2.3x orchestration 67% failures tool selection 31% context 22% retry 14% testing infrastructure 4.2 11.7 verification 23% memory multi-step 41% 3% scaffolding testing 2.3x orchestration 67% failures tool selection 31% context 22% retry 14% testing infrastructure 4.2 11.7 verification 23% memory multi-step 41% 3% scaffolding testing 2.3x orchestration 67% failures tool selection 31% context 22% retry 14% testing infrastructure 4.2 11.7 verification 23% memory multi-step 41% 3% scaffolding testing 2.3x orchestration 67% failures tool selection 31% context 22% retry 14% testing infrastructure 4.2 11.7 verification 23% memory multi-step 41% 3% scaffolding testing 2.3x orchestration 67% failures tool selection 31% context 22% retry 14% testing infrastructure 4.2 11.7 verification 23% memory multi-step 41% 3% scaffolding testing 2.3x orchestration 67% failures tool selection 31% context 22% retry 14% testing infrastructure 4.2 11.7 verification 23% memory multi-step 41% 3% scaffolding testing 2.3x orchestration 67% failures tool selection 31% context 22% retry 14% testing infrastructure 4.2 11.7 verification 23% memory multi-step 41% 3% scaffolding testing 2.3x orchestration 67% failures tool selection 31% context 22% retry 14% testing infrastructure 4.2 11.7 verification 23% memory multi-step 41% 3% scaffolding testing 2.3x orchestration 67% failures tool selection 31% context 22% retry 14% testing infrastructure 4.2 11.7 verification 23% memory multi-step 41% 3% scaffolding testing 2.3x",
    "recommendations": [
      "Evaluate scaffolds under fixed model conditions."
    ],
    "source_reliability_notes": "Synthetic demo sources only."
  },
  "metrics": {
    "input_tokens": 0,
    "output_tokens": 0,
    "cost_usd": 0.0,
    "wall_time_ms": null,
    "num_api_calls": 0,
    "provider_usage_status": "known_none_no_provider_invoked",
    "measurement_scope": "fixture_deterministic_controls",
    "latency_status": "not_measured"
  },
  "evaluation": {
    "total_score": 100.0,
    "breakdown": {
      "citation_coverage": 100.0,
      "required_findings_coverage": 100.0,
      "schema_validity": 100.0,
      "word_count_compliance": 100.0
    },
    "weights": {
      "citation_coverage": {
        "type": "deterministic",
        "weight": 0.378927
      },
      "required_findings_coverage": {
        "type": "deterministic",
        "weight": 0.270662
      },
      "schema_validity": {
        "type": "deterministic",
        "weight": 0.162397
      },
      "word_count_compliance": {
        "type": "deterministic",
        "weight": 0.108265
      },
      "synthesis_quality": {
        "type": "judge",
        "weight": 0.053166
      },
      "recommendation_quality": {
        "type": "judge",
        "weight": 0.026583
      }
    },
    "profile": "strict",
    "notes": [
      "Schema fully valid",
      "Word count 230 is within 150-250 bounds"
    ],
    "judge": null,
    "deterministic_weight": 0.920251
  },
  "evidence": [
    {
      "kind": "fixture_control",
      "summary": "positive control for research: positive_control"
    }
  ],
  "limitations": [
    "Fixture-mode artifact generated from deterministic controls, not a live provider run.",
    "No provider was invoked, so provider input tokens, output tokens, cost, and API calls are known to be none and recorded as zero.",
    "Fixture runtime latency was not measured; wall_time_ms is null.",
    "Timestamps are fixed fixture values for reproducibility, not observed execution times.",
    "Fixture scores are deterministic control outcomes, not model-performance evidence.",
    "Use live mode before making provider/model performance claims."
  ]
}
