{
  "schema_version": "0.1",
  "run_id": "fixture_strategy_positive_control_r2",
  "protocol_version": "0.1",
  "mode": "fixture",
  "task_family": "strategy",
  "task_id": "strategy_to_system",
  "scenario_id": "strategy_positive_control",
  "control": "positive_control",
  "expected_role": "positive",
  "model_id": "fixture-no-provider-deterministic-v1",
  "scaffold_id": "full_scaffold",
  "evaluation_profile": "strict",
  "created_at": "2026-05-23T00:00:00Z",
  "output": {
    "architecture_decisions": [
      "Keep raw call transcripts inside the account workspace.",
      "Add audit trail for every generated obligation."
    ],
    "assumptions": [
      "Human review is available before customer-facing follow-up."
    ],
    "risks": [
      "Risk flags may become noisy."
    ],
    "eval_plan": [
      "Measure risk flag precision, obligation recall, and audit trail completeness."
    ],
    "implementation_backlog": [
      "Add rollback controls and cost tracking."
    ],
    "success_metrics": [
      "Cost stays below $0.40 per analyzed call."
    ],
    "open_questions": [
      "Which customer-facing obligations require legal review?"
    ]
  },
  "metrics": {
    "input_tokens": 0,
    "output_tokens": 0,
    "cost_usd": 0.0,
    "wall_time_ms": null,
    "num_api_calls": 0,
    "provider_usage_status": "known_none_no_provider_invoked",
    "measurement_scope": "fixture_deterministic_controls",
    "latency_status": "not_measured"
  },
  "evaluation": {
    "total_score": 100.0,
    "breakdown": {
      "schema_validity": 100.0,
      "required_section_coverage": 100.0,
      "required_term_coverage": 100.0,
      "unsupported_claim_avoidance": 100.0
    },
    "weights": {
      "schema_validity": {
        "type": "deterministic",
        "weight": 0.316087
      },
      "required_section_coverage": {
        "type": "deterministic",
        "weight": 0.316087
      },
      "required_term_coverage": {
        "type": "deterministic",
        "weight": 0.210724
      },
      "unsupported_claim_avoidance": {
        "type": "deterministic",
        "weight": 0.105362
      },
      "actionability": {
        "type": "judge",
        "weight": 0.05174
      }
    },
    "profile": "strict",
    "notes": [
      "Schema fully valid"
    ],
    "judge": null,
    "deterministic_weight": 0.94826
  },
  "evidence": [
    {
      "kind": "fixture_control",
      "summary": "positive control for strategy: positive_control"
    }
  ],
  "limitations": [
    "Fixture-mode artifact generated from deterministic controls, not a live provider run.",
    "No provider was invoked, so provider input tokens, output tokens, cost, and API calls are known to be none and recorded as zero.",
    "Fixture runtime latency was not measured; wall_time_ms is null.",
    "Timestamps are fixed fixture values for reproducibility, not observed execution times.",
    "Fixture scores are deterministic control outcomes, not model-performance evidence.",
    "Use live mode before making provider/model performance claims."
  ]
}
