{
  "schema_version": "0.1",
  "run_id": "sample_run_strategy_001",
  "protocol_version": "0.1",
  "mode": "sample",
  "scenario_id": "strategy_to_system_demo",
  "task_family": "strategy",
  "model_id": "fixture-model",
  "scaffold_id": "plan_execute_verify",
  "evaluation_profile": "strict",
  "created_at": "2026-05-22T00:00:00Z",
  "completed_at": "2026-05-22T00:00:03Z",
  "output": {
    "architecture_decisions": ["Use retrieval with source-level evidence records."],
    "assumptions": ["Human review is available for high-risk launches."],
    "risks": ["Cost ceiling can be exceeded without per-run budget checks."],
    "eval_plan": ["Run deterministic schema and evidence checks before release."],
    "implementation_backlog": ["Add rollback path for unsafe deployment."],
    "success_metrics": ["Pass rate, cost per accepted run, and regression count."],
    "open_questions": ["Which production data classes are excluded from prompts?"]
  },
  "metrics": {
    "input_tokens": 1100,
    "output_tokens": 420,
    "cost_usd": 0.031,
    "wall_time_ms": 3100,
    "num_api_calls": 2
  },
  "evaluation": {
    "total_score": 91.2,
    "deterministic_weight": 0.9,
    "breakdown": {
      "schema_validity": 100,
      "required_section_coverage": 100,
      "required_term_coverage": 80
    },
    "notes": ["Fixture artifact for schema validation; not a live provider run."]
  },
  "evidence": [
    {
      "kind": "schema",
      "summary": "Output includes all required strategy-to-system sections.",
      "source": "docs/benchmarking/sample_scenario.json"
    },
    {
      "kind": "cost",
      "summary": "Cost is non-zero when token usage is non-zero."
    }
  ],
  "limitations": [
    "This is a static fixture used to validate the protocol schema.",
    "Do not cite this as a measured model benchmark."
  ]
}
