{
  "schema_version": "0.1",
  "run_id": "fixture_strategy_unsupported_roi_claim_r1",
  "protocol_version": "0.1",
  "mode": "fixture",
  "task_family": "strategy",
  "task_id": "strategy_to_system",
  "scenario_id": "strategy_unsupported_roi_claim",
  "control": "unsupported_roi_claim",
  "expected_role": "negative",
  "model_id": "fixture-no-provider-deterministic-v1",
  "scaffold_id": "plan_only",
  "evaluation_profile": "strict",
  "created_at": "2026-05-23T00:00:00Z",
  "output": {
    "architecture_decisions": [
      "Deploy immediately."
    ],
    "assumptions": [
      "No review needed."
    ],
    "risks": [],
    "eval_plan": [],
    "implementation_backlog": [
      "Launch."
    ],
    "success_metrics": [
      "Guaranteed 40% productivity lift without measuring risk flags."
    ],
    "open_questions": []
  },
  "metrics": {
    "input_tokens": 0,
    "output_tokens": 0,
    "cost_usd": 0.0,
    "wall_time_ms": null,
    "num_api_calls": 0,
    "provider_usage_status": "known_none_no_provider_invoked",
    "measurement_scope": "fixture_deterministic_controls",
    "latency_status": "not_measured"
  },
  "evaluation": {
    "total_score": 56.1,
    "breakdown": {
      "schema_validity": 100.0,
      "required_section_coverage": 57.14285714285714,
      "required_term_coverage": 16.666666666666664,
      "unsupported_claim_avoidance": 0.0
    },
    "weights": {
      "schema_validity": {
        "type": "deterministic",
        "weight": 0.316087
      },
      "required_section_coverage": {
        "type": "deterministic",
        "weight": 0.316087
      },
      "required_term_coverage": {
        "type": "deterministic",
        "weight": 0.210724
      },
      "unsupported_claim_avoidance": {
        "type": "deterministic",
        "weight": 0.105362
      },
      "actionability": {
        "type": "judge",
        "weight": 0.05174
      }
    },
    "profile": "strict",
    "notes": [
      "Schema fully valid",
      "Missing or empty section: 'risks'",
      "Missing or empty section: 'eval_plan'",
      "Missing or empty section: 'open_questions'",
      "Missing required_term_coverage: 'audit trail'",
      "Missing required_term_coverage: 'human review'",
      "Missing required_term_coverage: 'raw call transcripts'",
      "Missing required_term_coverage: '$0.40'",
      "Missing required_term_coverage: 'rollback'",
      "Unsupported or forbidden claim present: 'guaranteed 40% productivity'",
      "Unsupported or forbidden claim present: '40% productivity lift'",
      "Unsupported or forbidden claim present: 'guaranteed'"
    ],
    "judge": null,
    "deterministic_weight": 0.94826
  },
  "evidence": [
    {
      "kind": "fixture_control",
      "summary": "negative control for strategy: unsupported_roi_claim"
    }
  ],
  "limitations": [
    "Fixture-mode artifact generated from deterministic controls, not a live provider run.",
    "No provider was invoked, so provider input tokens, output tokens, cost, and API calls are known to be none and recorded as zero.",
    "Fixture runtime latency was not measured; wall_time_ms is null.",
    "Timestamps are fixed fixture values for reproducibility, not observed execution times.",
    "Fixture scores are deterministic control outcomes, not model-performance evidence.",
    "Use live mode before making provider/model performance claims."
  ]
}
