{
  "schema_version": "0.1",
  "run_id": "fixture_extraction_positive_control_r1",
  "protocol_version": "0.1",
  "mode": "fixture",
  "task_family": "extraction",
  "task_id": "extraction",
  "scenario_id": "extraction_positive_control",
  "control": "positive_control",
  "expected_role": "positive",
  "model_id": "fixture-no-provider-deterministic-v1",
  "scaffold_id": "full_scaffold",
  "evaluation_profile": "strict",
  "created_at": "2026-05-23T00:00:00Z",
  "output": {
    "document_type": "Amendment to Service Agreement",
    "effective_date": "2025-03-15",
    "parties": [
      {
        "name": "TechFlow Solutions Inc.",
        "role": "Provider",
        "entity_type": "corporation",
        "jurisdiction": "Delaware",
        "address": "2847 Innovation Drive, Suite 400, Austin, TX 78701"
      },
      {
        "name": "Meridian Healthcare Group, LLC",
        "role": "Client",
        "entity_type": "limited liability company",
        "jurisdiction": "California",
        "address": "1200 Harbor Boulevard, Floor 12, San Francisco, CA 94111"
      }
    ],
    "references_agreement": {
      "name": "Master Service Agreement",
      "date": "2023-09-01"
    },
    "new_expiration_date": "2027-12-31",
    "compliance_requirements": [
      "HIPAA",
      "CCPA",
      "SOC 2 Type II"
    ],
    "financial_summary": {
      "monthly_retainer_old": 45000,
      "monthly_retainer_new": 78500,
      "one_time_fees": [
        {
          "amount": 125000,
          "description": "Implementation fee due within 30 days"
        }
      ],
      "liability_cap": "Total fees paid in the 12 months preceding any claim",
      "insurance_minimum": 5000000
    }
  },
  "metrics": {
    "input_tokens": 0,
    "output_tokens": 0,
    "cost_usd": 0.0,
    "wall_time_ms": null,
    "num_api_calls": 0,
    "provider_usage_status": "known_none_no_provider_invoked",
    "measurement_scope": "fixture_deterministic_controls",
    "latency_status": "not_measured"
  },
  "evaluation": {
    "total_score": 92.5,
    "breakdown": {
      "schema_validity": 87.5,
      "field_accuracy": 100.0
    },
    "weights": {
      "schema_validity": {
        "type": "deterministic",
        "weight": 0.515601
      },
      "field_accuracy": {
        "type": "deterministic",
        "weight": 0.343734
      },
      "completeness": {
        "type": "judge",
        "weight": 0.084399
      },
      "reasoning_clarity": {
        "type": "judge",
        "weight": 0.056266
      }
    },
    "profile": "strict",
    "notes": [
      "Missing required field: 'amendments' is a required property"
    ],
    "judge": null,
    "deterministic_weight": 0.859335
  },
  "evidence": [
    {
      "kind": "fixture_control",
      "summary": "positive control for extraction: positive_control"
    }
  ],
  "limitations": [
    "Fixture-mode artifact generated from deterministic controls, not a live provider run.",
    "No provider was invoked, so provider input tokens, output tokens, cost, and API calls are known to be none and recorded as zero.",
    "Fixture runtime latency was not measured; wall_time_ms is null.",
    "Timestamps are fixed fixture values for reproducibility, not observed execution times.",
    "Fixture scores are deterministic control outcomes, not model-performance evidence.",
    "Use live mode before making provider/model performance claims."
  ]
}
